{
  "id": "usts",
  "name": "苏州科技大学",
  "region": "江苏",
  "type": "university",
  "system": "jwglxt",
  "aliases": ["苏州科技大学", "苏科大", "USTS"],
  "timetable": {
    "id": "usts",
    "name": "苏州科技大学",
    "source": "学校教务处公告（用户提供截图）",
    "periods": [
      { "periodNo": 1, "start": "08:00", "end": "08:45" },
      { "periodNo": 2, "start": "08:55", "end": "09:40" },
      { "periodNo": 3, "start": "09:55", "end": "10:40" },
      { "periodNo": 4, "start": "10:50", "end": "11:35" },
      { "periodNo": 5, "start": "11:45", "end": "12:30" },
      { "periodNo": 6, "start": "12:40", "end": "13:25" },
      { "periodNo": 7, "start": "13:35", "end": "14:20" },
      { "periodNo": 8, "start": "14:30", "end": "15:15" },
      { "periodNo": 9, "start": "15:25", "end": "16:10" },
      { "periodNo": 10, "start": "16:20", "end": "17:05" },
      { "periodNo": 11, "start": "17:15", "end": "18:00" },
      { "periodNo": 12, "start": "18:10", "end": "18:55" },
      { "periodNo": 13, "start": "19:05", "end": "19:50" },
      { "periodNo": 14, "start": "20:00", "end": "20:45" }
    ]
  }
}
